Müşteri Bilgisi, Sipariş, Notlar, Tarih-Saat, Tutar, TC Kimlik Numarası, Kart Numarası, Şifre
Ali,"Domino's Pizza, Et, Hardal, Kola",asdfasdf,2023-03-09 20:50:52,86,31198671208,1111222244448888,8888
cengizhan civelek,"Margarita Pizza, , Ketçap, BBQ Sos, , Türk Pizzası, Et, Ketçap, Ranch Sos, Fanta, Ayran","ehbed, not",2023-03-11 19:38:39,336,44444444440,0,0
Sevde,"Domino's Pizza, Zeytin, Et, Mısır, Ketçap, Mayonez, Hardal, BBQ Sos, Acı Sos, Gazoz, Limonata","Lutfen yarisina zeytin koyunnnn
iki premsesss sizi bekliyoruzz, acele edin lutfennn
cok acizz, gelip doyurun biziii",2023-03-11 21:08:01,188,55555555550,1234567887654321,0
efe atasoy,"Klasik Pizza, Zeytin, Mantar, Et, Soğan, Mısır, Ketçap, Mayonez, Ayran, , , , Gazoz","bol kasarli
, ",2023-03-12 00:10:05,205,55555555550,1231231231231245,5555
BAris Atasoy,"Klasik Pizza, Zeytin, Et, , Gazoz",NOt,2023-03-13 11:31:11,86,22222222220,6666666666666666,0
a a,"BBQ Sos, ",,2023-03-13 11:35:57,16,55555555550,1111111111111111,0
